project_ID,NBS_group,NBS_activity,NBS_group2,NBS_activity2,methodology,registry,LU,area,directArea,credit_length,totalERs,coords,mulitpleLocations,LUCdate,previousLU,KML,costs_deploy,costs_deploy_detail,costs_manage,costs_manage_detail,costs_monitor,costs_monitor_detail,LAT,LON,description,notes,project_name,project_proponent,validator,validation_date,verfier1,verification_date1,country,sectoral_scope,estimated_annual_emission_reductions,active_CCB_status,CCB_yes,reference,shell_review,shell_review_date,shell_review_person,shell_decision,shell_reason,shell_volume_date,shell_volume_purchase,shell_volume_retired
VCS1332,Forest,NovoForest_Reforestation,Forest,Reforestation,AR-ACM0003,APX,Hardwoods,159.20,1,30,100973.00,"29.748842, 102.429540",1,2012,Fallow,1,,,,,,,29.748842, 102.429540,"The project is to establish 159.2ha of mingle forest by direct planting on degraded land previously logged. Estimated GHG emissions reductions are for 100,973tCO2e in 30 years, with an average annual GHG emission of 3,365tCO2e. ",Restored forest after logging,"Reforestation Project in Yingjing County, Sichuan Province",MULTIPLE PROJECT PROPONENTS,T‹V Nord Cert GmbH,,Bureau Veritas India Pvt. Ltd.,2016-01-09,China,"14. Agriculture, Forestry, Land Use",3365,Verification approved,1,https://www.vcsprojectdatabase.org/services/publicViewServices/downloadDocumentById/25980,0,,,,,,,
VCS1339,Forest,NovoForest_Afforestation,Forest,Afforestation,AR-AMS0007,APX,Bamboo,4.40,1,20,1257.00,"-25.983294, 27.533699",1,1979,Fallow,1,,,,,,,-25.983294, 27.533699,Renencomís (project proponent) afforestation project consists of planting of Bamboo on land situated within South Africa which is unutilized (fallow grassland) in the baseline.,Plants bamboo on degraded lands,Renencom Afforestation/Reforestation Grouped Project,Renencom,T‹V Nord Cert GmbH,2014-11-10,,,South Africa,"14. Agriculture, Forestry, Land Use",66,,0,https://www.vcsprojectdatabase.org/services/publicViewServices/downloadDocumentById/16580,0,,,,,,,
VCS1340,Forest,AvoiForest_REDD,Forest,REDD,VM0015,APX,Hardwoods,261053.00,1,20,25776421.00,"6.640411, 40.004855",1,NA,NONE,1,,,,,,,6.640411, 40.004855,"The project avoids deforestation of 261,053 ha of forest in Ethiopia's Bale Mountain Region",Avoided deforestation,Bale Mountains Eco-region REDD+ project,Oromia Forest and Wildlife Enterprise,T‹V S‹D Industrie Service GmbH,2017-06-20,,,Ethiopia,"14. Agriculture, Forestry, Land Use",1288821,Verification approved,1,https://www.vcsprojectdatabase.org/services/publicViewServices/downloadDocumentById/28244,1,,,Approved,,,,
VCS1343,Forest,NovoForest_Reforestation,Forest,Reforestation,AR-ACM0003,Markit,Shrub,5185.00,1,54,2387113.00,"-33.155836, 25.386320",1,,,1,,"110 labourers to plant ~1,100 hectares per year for 5 years",,,,,-33.155836, 25.386320,The project is restoring more than 5000 hectares of degraded thicket vegetation in the Kuzuko Lodge Private Game Reserve in the Eastern Cape of South Africa,Revegate degraded land,Kuzuko Lodge Private Game Reserve thicket restoration project,Spekboom Trading (Pty) Ltd,Environmental Services Inc,,,,South Africa,"14. Agriculture, Forestry, Land Use",44206,Validation approved,1,https://www.vcsprojectdatabase.org/services/publicViewServices/downloadDocumentById/15996,0,,,,,,,
VCS1351,Agriculture,RestAgriculture_Agroforestry,Agriculture,APlanting,AR-AM0003,APX,Mixed,25.20,1,30,9356.92,"-3.914519, -73.344438",0,,Pasture,1,,,,,,,-3.914519, -73.344438,"The project provides seedlings and training to farmers to reforest their farms, providing access to formal markets for native fruit and timber and helping to generate market-orientated agroforestry systems.",Agroforestry replaces degraded land,Planting for the Future: Financially sustainable agroforestry systems and payments for ecosystem services,Plant your Future,"Rainforest Alliance, Inc.",2015-02-18,"Rainforest Alliance, Inc.",,Peru,"14. Agriculture, Forestry, Land Use",719,Validation approved,1,https://www.vcsprojectdatabase.org/services/publicViewServices/downloadDocumentById/17353,0,,,,,,,
VCS1359,Forest,AvoiForest_REDD,Forest,REDD,VM0006,Markit,Hardwoods,187571.00,1,30,9736022.00,"0.058571, 23.850829",0,NA,NONE,1,,,,,,,0.058571, 23.850829,"The Project is to prevent deforestation of forest in 187,571 hectares of DRC",Avoided deforestation,Isangi REDD+ Project,"SAFBOIS, SPRL","Rainforest Alliance, Inc.",2014-09-09,"Rainforest Alliance, Inc.",2014-12-18,"Congo, the Democratic Republic of the","14. Agriculture, Forestry, Land Use",324534,Verification approved,1,https://www.vcsprojectdatabase.org/services/publicViewServices/downloadDocumentById/16846,0,,,,,,,
VCS1360,Forest,AvoiForest_REDD,Forest,REDD,VM0015,Markit,Hardwoods,127004.00,1,20,5648184.70,"-9.196431, -74.388001",1,NA,NONE,1,,,,,,,-9.196431, -74.388001,The purpose of the project is to conserve the forests of these communities with the advance of deforestation and degradation.,Avoided deforestation,Forest Management to reduce deforestation and degradation in Shipibo Conibo and Cacataibo Indigenous communities of Ucayali region,MULTIPLE PROJECT PROPONENTS,,,,,Peru,"14. Agriculture, Forestry, Land Use",564818,Under verification,0,https://www.vcsprojectdatabase.org/services/publicViewServices/downloadDocumentById/18227,1,,,Approved,,,,
VCS1361,Forest,NovoForest_Reforestation,Forest,Reforestation,AR-ACM0003,APX,Conifers,1367.47,1,30,205891.08,"35.951071, 101.748058",1,2013,Shrubs,1,,,,,,,35.951071, 101.748058,"The project establishes forest on previously logged land with 1367.47ha of forest established by direct planting on degraded lands in five counties. This aims to reduce the GHG emissions for 207,953.23tCO2e in 30 years, with an average annual GHG emission of 6,708.17tCO2e.",Reforest degraded land,Reforestation Project in Qinghai Province 2012,MULTIPLE PROJECT PROPONENTS,T‹V Nord Cert GmbH,2015-03-29,,,China,"14. Agriculture, Forestry, Land Use",6708,,0,https://www.vcsprojectdatabase.org/services/publicViewServices/downloadDocumentById/17974,0,,,,,,,
VCS1367,Forest,RestForest_Natural-Management,Forest,FManagement,VM0003,Markit,Mixed,397.24,1,30,150032.00,"45.588500, -123.812370",0,2010,Forest,1,,,,,,,45.588500, -123.812370,The project shifts forest management practice from an even-aged clear-cut to varied-aged harvesting meaning that the average stand age will increase,Change forest management,Ecotrust Forest Management Improved Forest Management Group Project,Ecotrust Forest Management,"Rainforest Alliance, Inc.",2014-12-04,"Rainforest Alliance, Inc.",2014-12-04,United States,"14. Agriculture, Forestry, Land Use",5001,,0,https://www.vcsprojectdatabase.org/services/publicViewServices/downloadDocumentById/16808,0,,,,,,,
VCS1377,Forest,RestForest_Improved-Plantation,Forest,FManagement,VM0003,Markit,Mixed,1985.22,1,58,370301.00,"41.112994, -77.330563",1,2010,Plantation,1,,,,,,,41.112994, -77.330563,"The project will extend the rotation age of the timber resource on the 4905 acre property by approximately 45 years compared to Common Practice. On average, this will generate 6,383 mtCO2e annually and 370,187 mtCO2e total GHG emission reductions and removals.",Change forest management,Lock Haven Improved Forest Management Project,Lock Haven City Authority,,,,,United States,"14. Agriculture, Forestry, Land Use",6384,,0,https://www.vcsprojectdatabase.org/services/publicViewServices/downloadDocumentById/17173,0,,,,,,,
VCS1378,Forest,NovoForest_Reforestation,Forest,Reforestation,AR-ACM0003,APX,Mixed,4538.70,,20,755678.10,"5.098341, -75.471720",1,,,1,,,,,,,5.098341, -75.471720,The programís activities involve ecological restoration to improve water quality through assisted natural regeneration and reforestation. The species used for the assisted natural regeneration system come from the natural forests within the project boundary.,Reforest degraded land,"Forestry Project for the Basin of the Chinchina River, an Environmental and Productive Alternative for the City and the Region",MULTIPLE PROJECT PROPONENTS,Colombian Institute for Technical Standards and Certification (ICONTEC),2015-05-10,Colombian Institute for Technical Standards and Certification (ICONTEC),2015-05-10,Colombia,"14. Agriculture, Forestry, Land Use",12189,,0,https://www.vcsprojectdatabase.org/services/publicViewServices/downloadDocumentById/17936,0,,,,,,,
VCS1382,Forest,AvoiForest_REDD,Forest,REDD,VM0007,Markit,Hardwoods,39300.00,1,10,12596462.00,"-8.828485, -70.155918",0,NA,NONE,1,,,,,,,-8.828485, -70.155918,The Envira Amazonia REDD APD Project will generate GHG emission reductions by foregoing forest conversion to grassland in favor of conservation of the tropical forest,Avoided deforestation,"The Envira Amazonia Project - A Tropical Forest Conservation Project in Acre, Brazil",MULTIPLE PROJECT PROPONENTS,Environmental Services Inc,2015-04-06,Environmental Services Inc,2016-03-08,Brazil,"14. Agriculture, Forestry, Land Use",1259646,"Verified, under verification",1,https://www.vcsprojectdatabase.org/services/publicViewServices/downloadDocumentById/17499,0,,,,,,,
VCS1384,Forest,AvoiForest_REDD,Forest,REDD,VM0015,Markit,Hardwoods,660820.00,1,30,41579156.00,"17.211481, -89.631842",0,NA,NONE,1,,,,,,,17.211481, -89.631842,"The project avoids deforestation of 660,820 ha of forest in Guatemala",Avoided deforestation,Reduced Emissions from Avoided Deforestation in the Multiple Use Zone of the Maya Biosphere Reserve in Guatemala (GuateCarbon),Consejo Nacional de √Åreas Protegidas (CONAP),"AENOR Internacional, S.A.U.",2015-11-10,,2017-06-08,Guatemala,"14. Agriculture, Forestry, Land Use",1385971,Verification approved,1,https://www.vcsprojectdatabase.org/services/publicViewServices/downloadDocumentById/19267,1,,,HOLD,,,,
VCS1389,Forest,AvoiForest_REDD,Forest,REDD,VM0006,Markit,Hardwoods,140870.00,1,30,10535712.00,"1.819172, -78.541096",1,NA,NONE,1,,,,,,,1.819172, -78.541096,"The project mitigates climate change, protects rich biodiversity, and generates sources of income for poor communities, through forest governance, capacity building, and productive activities that will prevent selective logging of native forests, avoiding degradation and deforestation.",Avoided deforestation,Acapa -¬≠ Bajo Mira Y Frontera REDD+ Project,MULTIPLE PROJECT PROPONENTS,"Rainforest Alliance, Inc.",2015-04-21,,,Colombia,"14. Agriculture, Forestry, Land Use",404786,Validation approved,1,https://www.vcsprojectdatabase.org/services/publicViewServices/downloadDocumentById/20393,0,,,,,,,
VCS1390,Forest,AvoiForest_REDD,Forest,REDD,VM0006,Markit,Hardwoods,118318.00,1,30,12391716.00,"6.799492, -77.185938",0,NA,NONE,1,,,,,,,6.799492, -77.185938,"The project is to prevent deforestation and is estimated to generate approximately 12,391,716 VCUs over 30 years",Avoided deforestation,Carmen del Dari√©n (CDD) REDD+ Project,MULTIPLE PROJECT PROPONENTS,"Rainforest Alliance, Inc.",2015-04-22,,,Colombia,"14. Agriculture, Forestry, Land Use",462190,Validation approved,1,https://www.vcsprojectdatabase.org/services/publicViewServices/downloadDocumentById/20958,0,,,,,,,
VCS1391,Forest,AvoiForest_REDD,Forest,REDD,VM0006,Markit,Hardwoods,47667.00,1,30,7917741.00,"5.128236, -77.380168",1,NA,NONE,1,,,,,,,5.128236, -77.380168,The Project is to prevent deforestation of forest in Western Colombia,Avoided deforestation,SUPP REDD+ Project,MULTIPLE PROJECT PROPONENTS,,2015-04-21,,,Colombia,"14. Agriculture, Forestry, Land Use",312078,Validation approved,1,https://www.vcsprojectdatabase.org/services/publicViewServices/downloadDocumentById/20380,0,,,,,,,
VCS1392,Forest,AvoiForest_REDD,Forest,REDD,VM0006,Markit,Hardwoods,60316.00,1,30,7358393.00,"3.307219, -77.105727",0,NA,NONE,1,,,,,,,3.307219, -77.105727,"Project to mitigate climate change, protect rich biodiversity, and generate sources of income for poor communities, through forest governance, capacity building, and productive activities that will prevent selective logging of native forests, avoiding degradation and deforestation.",Avoided deforestation,Cajambre REDD+ Project,Consejo Comunitario de Cajambre,,,,,Colombia,"14. Agriculture, Forestry, Land Use",297488,Validation approved,1,https://www.vcsprojectdatabase.org/services/publicViewServices/downloadDocumentById/20315,0,,,,,,,
VCS1395,Forest,AvoiForest_REDD,Forest,REDD,VM0006,Markit,Hardwoods,83452.00,1,30,13031611.00,"4.040287, -76.983466",0,NA,NONE,1,,,,,,,4.040287, -76.983466,"Project to mitigate climate change, protect rich biodiversity, and generate sources of income for poor communities, through forest governance, capacity building, and productive activities that will prevent selective logging of native forests, avoiding degradation and deforestation.",Avoided deforestation,Bajo Calima y Bah√≠a M√°laga (BCBM) REDD+ Project,MULTIPLE PROJECT PROPONENTS,,,,,Colombia,"14. Agriculture, Forestry, Land Use",498719,Validation approved,1,https://www.vcsprojectdatabase.org/services/publicViewServices/downloadDocumentById/22544,0,,,,,,,
VCS1396,Forest,AvoiForest_REDD,Forest,REDD,VM0006,Markit,Hardwoods,48177.00,1,30,6135587.00,"5.119255, -76.930752",1,NA,NONE,1,,,,,,,5.119255, -76.930752,"REDD Project to prevent selective logging of native forests, avoiding degradation and deforestation.",Avoided deforestation,Rio Pepe y ACABA REDD+ Project,MULTIPLE PROJECT PROPONENTS,"Rainforest Alliance, Inc.",2015-04-22,,,Colombia,"14. Agriculture, Forestry, Land Use",224050,Validation approved,1,https://www.vcsprojectdatabase.org/services/publicViewServices/downloadDocumentById/20706,0,,,,,,,
VCS1397,Forest,NovoForest_Afforestation,Forest,Afforestation,AR-AMS0007,Markit,Mixed,5000.00,1,35,1384302.00,"-7.833128, -77.788723",1,,,1,,,,,,,-7.833128, -77.788723,The project develops cooperative enterprises comprised of local producers to establish 5000 ha of new pine and eucalyptus plantations on high altitude Andean pastures that were previously traditional land use schemes of low productivity animal husbandry.,Commercial plantations on degraded land,Reforestation of pasture lands on the Peruvian Northern Andes ‚Äì ‚ÄúForestry PRODICOM‚Äù Grouped Project,MULTIPLE PROJECT PROPONENTS,Ecocert S.A.,2015-04-17,,,Peru,"14. Agriculture, Forestry, Land Use",39551,,0,https://www.vcsprojectdatabase.org/services/publicViewServices/downloadDocumentById/17608,0,,,,,,,
VCS1398,Forest,AvoiForest_REDD,Forest,REDD,VM0015,APX,Hardwoods,51892.00,1,30,5735413.00,"14.397875, 106.140088",0,NA,NONE,1,,,,,,,14.397875, 106.140088,The main objective of the project is to provide sustainable long-term finance for an effective management of the Xe Pian NPA in order to avoid deforestation and enhance carbon stocks.,Avoided deforestation,Reducing Emissions from Deforestation and Carbon Enhancement in Xe Pian National Protected Area,Provincial Office of Agriculture and Forestry (PAFO),,,,,Laos,"14. Agriculture, Forestry, Land Use",64981,,0,https://www.vcsprojectdatabase.org/services/publicViewServices/downloadDocumentById/28819,0,,,,,,,
VCS1399,Forest,AvoiForest_REDD,Forest,REDD,VM0006,Markit,Hardwoods,34288.00,1,30,4241776.00,"7.165153, -76.464880",1,NA,NONE,1,,,,,,,7.165153, -76.464880,Project to promoting of avoiding degradation and deforestation,Avoided deforestation,Mutat√° REDD+ Project,Cabildo Mayor Ind√≠gena de Mutat√°,,,,,Colombia,"14. Agriculture, Forestry, Land Use",156476,Validation approved,1,https://www.vcsprojectdatabase.org/services/publicViewServices/downloadDocumentById/27662,0,,,,,,,
VCS1400,Forest,AvoiForest_REDD,Forest,REDD,VM0006,Markit,Hardwoods,54623.00,1,30,8272143.00,"4.481414, -77.333995",1,NA,NONE,1,,,,,,,4.481414, -77.333995,The Project is to prevent deforestation of forest in Western Colombia,Avoided deforestation,Concosta REDD+ Project,Consejo Comunitario de Concosta,"Rainforest Alliance, Inc.",2015-04-23,,,Colombia,"14. Agriculture, Forestry, Land Use",333978,Validation approved,1,https://www.vcsprojectdatabase.org/services/publicViewServices/downloadDocumentById/20401,0,,,,,,,
VCS1403,Forest,AvoiForest_REDD,Forest,REDD,VM0007,Markit,Hardwoods,71.50,1,20,25306.00,"-26.921057, -55.971129",0,NA,REDD,1,,,,,,,-26.921057, -55.971129,"The project goal is to conserve the Atlantic Forest in Eastern Paraguay through payments for forest conservation to small holders, with initial annual average GHG emission reductions estimated to be 1,265 tC02e while total GHG emission reductions are estimated to be 25,306 tC02e.",Avoided deforestation,"The Paraguay Forest Conservation Project ‚Äì Reduction of GHG Emissions from Deforestation and Forest Degradation in the Parana Atlantic Ecosystem ‚Äì Forest Protection in the La Amistad Community, San Rafael",Swire Pacific Offshore Operations (Pte) Ltd. (SPO),T‹V S‹D South Asia Private Limited,2015-10-28,T‹V S‹D South Asia Private Limited,2016-02-12,Paraguay,"14. Agriculture, Forestry, Land Use",1265,Verification approved,1,https://www.vcsprojectdatabase.org/services/publicViewServices/downloadDocumentById/19059,0,,,,,,,
VCS1408,Forest,AvoiForest_REDD,Forest,REDD,VM0009,Markit,Hardwoods,410533.00,1,30,37765494.00,"-2.804957, 37.686922",0,NA,NONE,1,,,,,,,-2.804957, 37.686922,"The project avoids deforestation of 410,533 ha of forest in Kenya",Avoided deforestation,Chyulu Hills REDD+ Project,Chyulu Hills Conservation Trust,SCS Global Services,2015-08-17,SCS Global Services,2017-06-27,Kenya,"14. Agriculture, Forestry, Land Use",1100943,Verification approved,1,https://www.vcsprojectdatabase.org/services/publicViewServices/downloadDocumentById/20659,1,,,Approved,,,,
VCS1414,Forest,NovoForest_Reforestation,Forest,Reforestation,AR-AM0007,Markit,Hardwoods,291.93,1,30,130108.00,"16.410785, -96.482137",1,2013,Pasture,1,,,,,,,16.410785, -96.482137,"Working with Rainforest Alliance certified coffee producers the project uses native trees with the aim of enhancing forest carbon stocks in eligible areas over a period of 30 years, while promoting sustainable coffee production.",Adds trees to agricutlure,Sustainable Climate-Friendly Coffee (CO2 Coffee),MULTIPLE PROJECT PROPONENTS,"AENOR Internacional, S.A.U.",2015-11-10,,,Mexico,"14. Agriculture, Forestry, Land Use",4337,,0,https://www.vcsprojectdatabase.org/services/publicViewServices/downloadDocumentById/18531,0,,,,,,,
VCS1429,Forest,NovoForest_Reforestation,Forest,Reforestation,AR-ACM0003,APX,"Melina, Cocoa and Plantain",218.78,1,100,74555.27,"8.300721, -76.424248",1,,,1,,,,,,,8.300721, -76.424248,"The grouped project proposes the recovery of degraded areas in Colombia by implementing agroforestry, silvopastoral and assisted natural regeneration systems, mixed-species plantations or any kind of land use multipurpose systems.",Mixed restoration on degraded land,Recovery of degraded areas with agroforestry systems in Colombia,MULTIPLE PROJECT PROPONENTS,Colombian Institute for Technical Standards and Certification (ICONTEC),2015-07-15,,,Colombia,"14. Agriculture, Forestry, Land Use",746,Validation approved,1,https://www.vcsprojectdatabase.org/services/publicViewServices/downloadDocumentById/18497,0,,,,,,,
VCS1434,Forest,NovoForest_Reforestation,Forest,Reforestation,AR-ACM0003,Markit,Hardwoods,680.84,1,100,178067.81,"6.231972, -75.568278",1,,,1,,,,,,,6.231972, -75.568278,"The project is based in the establishment of forest plantations, silvopastoral systems and assisted models for natural regeneration in areas of grasslands and stubbles in the Municipality of Medellin, department of Antioquia.",Mixed restoration on degraded land,Forestry Project: More Forests for Medellin,SecretarÌa del Medio Ambiente del Municipio de MedellÌn,Colombian Institute for Technical Standards and Certification (ICONTEC),,,,Colombia,"14. Agriculture, Forestry, Land Use",1781,,0,https://www.vcsprojectdatabase.org/services/publicViewServices/downloadDocumentById/17882,0,,,,,,,
VCS1463,Blue,RestMangrove,Blue,MangReforest,AR-AM0014,APX,Mangrove,4623.98,1,20,1024976.00,"22.006172, 88.601292",0,NA,NONE,1,,,,,,,22.006172, 88.601292,This reforestation project is a community initiative aiming to provide a new financing mechanism to overcome the current barriers to contribute positively to wetland restoration through mangrove reforestation.,Mangrove reforestation,India Sunderbans Mangrove Restoration,Livelihoods Fund,,,,,India,"14. Agriculture, Forestry, Land Use",51249,,0,https://www.vcsprojectdatabase.org/services/publicViewServices/downloadDocumentById/18008,0,,,,,,,
VCS1477,Wetland,AvoiPeatland,Wetland,Peatland,VM0007,APX,Peatland,149800.00,1,60,496789755.00,"-2.617447, 113.144696",0,NA,NONE,1,,,,,,,-2.617447, 113.144696,"The Katingan Restoration and Conservation Project (ëThe Katingan Projectí) protects and restores 149,800 hectares of peatland ecosystems, to offer local communities sustainable sources of income, and to tackle global climate change.",Protecting peatland,Katingan Peatland Restoration and Conservation Project,PT. Rimba Makmur Utama (PT. RMU),,,,,Indonesia,"14. Agriculture, Forestry, Land Use",7451846,Verification approved,1,https://www.vcsprojectdatabase.org/services/publicViewServices/downloadDocumentById/22577,1,,,Approved,,,,
VCS1493,Blue,RestMangrove,Blue,MangReforest,AR-AM0014,APX,Mangroves,5000.00,1,20,2494121.00,"4.645594, 97.590323",0,2011,Degraded,0,,,,,,,4.645594, 97.590323,"By helping to ensure that the mangrove and more generally the coastal green-belt are well maintained, the project will support Sumatraís future ecological, social and economic development.",Mangrove reforestation,"Mangrove restoration and coastal greenbelt protection in the East coast of Aceh and North Sumatra Province, Indonesia",Livelihoods Fund,SCS Global Services,2015-12-22,SCS Global Services,2015-12-22,Indonesia,"14. Agriculture, Forestry, Land Use",124706,,0,https://www.vcsprojectdatabase.org/services/publicViewServices/downloadDocumentById/18873,0,,,,,,,
VCS1496,Forest,NovoForest_Reforestation,Forest,Reforestation,AR-AMS0007,Markit,Hardwoods,1602.00,1,60,269078.00,"-7.073687, -76.796916",1,1990,Agriculture,1,,,,,,,-7.073687, -76.796916,The purpose of the project is to reforest this land and promote sustainable agroforestry in association with small-scale farmers located in the Andean Amazon region of the Yungas Peruanas. Reforestation by 1619 farmers on land parcels <20 ha that were deforested >10 years ago.,Reforesting Ag and abandoned land,Jubilaci√≥n Segura : Agroforestry And Reforestation With Smallscale Farmers in Peru,Pur Projet,Ecocert S.A.,2016-01-12,Ecocert S.A.,2016-02-09,Peru,"14. Agriculture, Forestry, Land Use",4485,,0,https://www.vcsprojectdatabase.org/services/publicViewServices/downloadDocumentById/19325,0,,,,,,,
VCS1503,Forest,AvoiForest_REDD,Forest,REDD,VM0015,Markit,Hardwoods,94289.00,1,30,12428713.00,"-8.860682, -62.299153",0,NA,NONE,1,,,,,,,-8.860682, -62.299153,The main goal of Resex Rio Preto-Jacund· REDD+ Project is the promotion of the sustainability of the exctractive community by reducing forest degradation and unplanned and illegal deforestation and consequent emission of greenhouse gases (GHG),Avoided deforestation,Resex Rio Preto-Jacund√° REDD+ Project,MULTIPLE PROJECT PROPONENTS,"Rainforest Alliance, Inc.",2016-06-14,"Rainforest Alliance, Inc.",2016-06-20,Brazil,"14. Agriculture, Forestry, Land Use",414290,Validation approved,1,https://www.vcsprojectdatabase.org/services/publicViewServices/downloadDocumentById/29356,0,,,,,,,
VCS1529,Forest,AvoiForest_REDD,Forest,REDD,VM0010,APX,Hardwoods,11010.00,1,20,1800701.00,"47.536170, 120.060693",1,2010,Commerical Forest,1,,,,,,,47.536170, 120.060693,"The main object of the project is to improve the forest coverage rate, protect local ecological environment, reduce carbon emissions and carbon sequestration by enhance the management level and converse logged to protected forest within the project area.",Avoided deforestation,Inner Mongolia Chao‚Äôer Improved Forest Management Project,"Chao‚Äôer Forest Bureau of Inner Mongolia Autonomous Region, P.R.China","China Environmental United Certification Center Co., Ltd. (CEC)",2016-01-13,"China Environmental United Certification Center Co., Ltd. (CEC)",2016-01-13,China,"14. Agriculture, Forestry, Land Use",90035,,0,https://www.vcsprojectdatabase.org/services/publicViewServices/downloadDocumentById/19455,0,,,,,,,
VCS1530,Forest,NovoForest_Reforestation,Forest,Reforestation,AR-ACM0003,Markit,Hardwoods,12172.00,1,30,1185191.26,"5.540990, -68.306977",1,,,1,,,,,,,5.540990, -68.306977,"The project is expected to reforest around 8,700 ha with commercial plantations, using Acacia, Eucalyptus, Pinus and 25 other native species as well as rubber. It is expected to capture 1,185,191 tCO2e over 30 years.",Commercial plantations on degraded land,Grouped Project for Commercial Forest Plantations Initiatives in the Department of Vichada,Fundaci√≥n Natura,Colombian Institute for Technical Standards and Certification (ICONTEC),2016-05-31,,,Colombia,"14. Agriculture, Forestry, Land Use",39506,Validation approved,1,https://www.vcsprojectdatabase.org/services/publicViewServices/downloadDocumentById/19508,0,,,,,,,
VCS1532,Forest,AvoiForest_REDD,Forest,REDD,"VM0015, VM0017",Markit,Hardwoods,116629.00,1,20,2440933.00,"-11.928079, 33.198685",1,NA,NONE,1,,,,,,,-11.928079, 33.198685,The COMACO Landscape Management Project (CLMP) promotes sustainable agriculture and forest conservation.,Avoided deforestation,COMACO Landscape Management Project,Community Markets for Conservation (COMACO),SCS Global Services,2017-08-28,SCS Global Services,2017-08-28,Zambia,"14. Agriculture, Forestry, Land Use",122047,,0,https://www.vcsprojectdatabase.org/services/publicViewServices/downloadDocumentById/28575,0,,,,,,,
